<employees xmlns:xsi="http://www.w3.org/2001/XMLSchema-instance"
    xsi:noNamespaceSchemaLocation="Employees.xsd">
    <employee>
                <employee_id>1</employee_id>
                <bank_id>1</bank_id>
                <first_name>John</first_name>
                <middle_name>Doe</middle_name>
                <last_name>Bill</last_name>
                <position>1</position>
                <branch_id>1</branch_id>
                <email>johndoebill@gmail.com</email>
    </employee>
    <employee>
        <employee_id>2</employee_id>
        <bank_id>1</bank_id>
        <first_name>Dave</first_name>
        <middle_name>David</middle_name>
        <last_name>Dav</last_name>
        <position>2</position>
        <branch_id>1</branch_id>
        <email>davedaviddav@gmail.com</email>
    </employee>
</employees>
